{
  "version": "agent6-training-demo-v1",
  "pipeline_version": "machine-logistic-v1",
  "champion_features": ["vibration_mm_s"],
  "candidate_numeric_features": ["temperature_c", "vibration_mm_s"],
  "candidate_categorical_features": ["machine_type"],
  "min_training_samples": 200,
  "min_validation_samples": 50,
  "min_test_samples": 50,
  "min_positive_per_split": 5,
  "min_f1_gain": 0.02,
  "max_p95_latency_ms": 200.0,
  "require_recall_nonregression": true,
  "random_state": 42
}
